{
  "documents": [
    {
      "id": "motion",
      "kind": "motion",
      "path": "motion.md",
      "role": "main",
      "sha256": "aec07f4e59b12b3ebf8331d7192d5b5be739a9943ac8af3412dd88ec4d1c0459",
      "size": 9
    },
    {
      "id": "exhibit-a",
      "kind": "documentary-exhibit",
      "path": "exhibit-a.txt",
      "role": "exhibit",
      "sha256": "8b7037685ab2dca21505485544f622ec835932abf10d09b26610949b1901b3cb",
      "size": 10
    },
    {
      "id": "exhibit-b",
      "kind": "documentary-exhibit",
      "path": "exhibit-b.txt",
      "role": "exhibit",
      "sha256": "428361a0db10744a5c6d4a821204b73fbd62a9108a686cfdae190dc672fea992",
      "size": 10
    }
  ],
  "packet_id": "synthetic-multi-exhibit",
  "provenance": {
    "input_manifest_sha256": "0000000000000000000000000000000000000000000000000000000000000000",
    "source_packet_sha256": null
  },
  "schema_version": 1
}
