{
  "documents": [
    {
      "id": "motion",
      "kind": "motion-for-leave",
      "path": "motion.md",
      "role": "main",
      "sha256": "c6d2c54fefd1b36019bcd55f614ea22b621723fbde804f6b42c270f656694ede",
      "size": 19
    },
    {
      "id": "amended-complaint",
      "kind": "amended-complaint",
      "path": "amended-complaint.md",
      "role": "exhibit",
      "sha256": "27bb750f87349af20df49304b562ef291a0b15797001d5d5318ce8b28b7f056d",
      "size": 29
    }
  ],
  "packet_id": "synthetic-leave-motion",
  "provenance": {
    "input_manifest_sha256": "0000000000000000000000000000000000000000000000000000000000000000",
    "source_packet_sha256": null
  },
  "schema_version": 1
}
