{
  "documents": [
    {
      "id": "response",
      "kind": "motion-response",
      "path": "response.md",
      "role": "main",
      "sha256": "f1219060f47c67006932c9c1de2a37faeb5d979c5d15a55e47f50a0cda0bfab5",
      "size": 11
    }
  ],
  "packet_id": "synthetic-response",
  "provenance": {
    "input_manifest_sha256": "0000000000000000000000000000000000000000000000000000000000000000",
    "source_packet_sha256": null
  },
  "schema_version": 1
}
