{
  "documents": [
    {
      "id": "complaint",
      "kind": "complaint",
      "path": "complaint.md",
      "role": "main",
      "sha256": "e3bbc33b833ff4088cba6d4795d1f5bf442bec5220a97d6c7659ab549a4b35e7",
      "size": 12
    }
  ],
  "packet_id": "synthetic-complaint",
  "provenance": {
    "input_manifest_sha256": "0000000000000000000000000000000000000000000000000000000000000000",
    "source_packet_sha256": null
  },
  "schema_version": 1
}
